{
  "run_id": "64b707cd-63a0-474b-ace8-dcfcfca9f902",
  "model_id": "mistral-small-3.2-24b-instruct",
  "task_class": "T3",
  "instance_id": "T3-00",
  "seed": 3362240963,
  "attempt": 1,
  "usage": {
    "input": 111,
    "output": 26,
    "cached_input": 0,
    "reasoning": 0
  },
  "latency_ms": 261,
  "gate_passed": true,
  "raw_response_ref": "64b707cd-63a0-474b-ace8-dcfcfca9f902.raw.json",
  "deviations": []
}
