{
  "run_id": "76868b99-c4c9-4e91-9412-1fcbe2a08814",
  "model_id": "grok-4.6",
  "task_class": "T3",
  "instance_id": "T3-00",
  "seed": 1877745922,
  "attempt": 1,
  "usage": {
    "input": 746,
    "output": 28,
    "cached_input": 0,
    "reasoning": 196
  },
  "latency_ms": 2127,
  "gate_passed": true,
  "raw_response_ref": "76868b99-c4c9-4e91-9412-1fcbe2a08814.raw.json",
  "deviations": [
    "mandatory reasoning (thinking cannot be disabled) — 196 reasoning tokens used, billed separately from and not counted against max_tokens"
  ]
}
