{
  "run_id": "05de9ab1-0513-402e-b609-0e8ecce2e41d",
  "model_id": "mistral-small-3.2-24b-instruct",
  "task_class": "T1",
  "instance_id": "T1-04",
  "seed": 618172419,
  "attempt": 1,
  "usage": {
    "input": 939,
    "output": 63,
    "cached_input": 272,
    "reasoning": 0
  },
  "latency_ms": 621,
  "gate_passed": true,
  "raw_response_ref": "05de9ab1-0513-402e-b609-0e8ecce2e41d.raw.json",
  "deviations": []
}
