{
  "run_id": "3a20f404-4b76-4f74-9dea-7ff7cfe64174",
  "model_id": "gemini-3.1-pro-preview",
  "task_class": "T1",
  "instance_id": "T1-03",
  "seed": 1381544637,
  "attempt": 1,
  "usage": {
    "input": 971,
    "output": 70,
    "cached_input": 0,
    "reasoning": 575
  },
  "latency_ms": 6648,
  "gate_passed": true,
  "raw_response_ref": "3a20f404-4b76-4f74-9dea-7ff7cfe64174.raw.json",
  "deviations": [
    "completion truncated by mandatory reasoning (finishReason MAX_TOKENS, 488 reasoning tokens against a 512-token task budget) — retried with reasoning accommodated above the task budget, capped at 3x (2048 tokens total)"
  ]
}
