{
  "run_id": "eebd026a-7471-471e-a943-0e890553ee9a",
  "model_id": "mistral-small-3.2-24b-instruct",
  "task_class": "T3",
  "instance_id": "T3-01",
  "seed": 2977028032,
  "attempt": 1,
  "usage": {
    "input": 142,
    "output": 68,
    "cached_input": 0,
    "reasoning": 0
  },
  "latency_ms": 258,
  "gate_passed": true,
  "raw_response_ref": "eebd026a-7471-471e-a943-0e890553ee9a.raw.json",
  "deviations": [
    "retry 1: OpenAI-compatible request failed: 429"
  ]
}
