{
  "run_id": "772e9867-787e-4deb-9bb6-ef39ef18fa7d",
  "model_id": "llama-3.3-70b-deepinfra",
  "task_class": "T3",
  "instance_id": "T3-01",
  "seed": 1814924610,
  "attempt": 1,
  "usage": {
    "input": 147,
    "output": 61,
    "cached_input": 0,
    "reasoning": 0
  },
  "latency_ms": 435,
  "gate_passed": true,
  "raw_response_ref": "772e9867-787e-4deb-9bb6-ef39ef18fa7d.raw.json",
  "deviations": []
}
