{
  "run_id": "ca6e10af-e332-4bef-949d-1231d7993f04",
  "model_id": "grok-4.6",
  "task_class": "T2",
  "instance_id": "T2-01",
  "seed": 3107248257,
  "attempt": 1,
  "usage": {
    "input": 21502,
    "output": 20,
    "cached_input": 512,
    "reasoning": 382
  },
  "latency_ms": 7156,
  "gate_passed": true,
  "raw_response_ref": "ca6e10af-e332-4bef-949d-1231d7993f04.raw.json",
  "deviations": [
    "mandatory reasoning (thinking cannot be disabled) — 382 reasoning tokens used, billed separately from and not counted against max_tokens"
  ]
}
