{
  "run_id": "6d7aa3a5-5abe-4dec-951c-56ecaed7e671",
  "model_id": "qwen-2.5-72b-instruct",
  "task_class": "T2",
  "instance_id": "T2-00",
  "seed": 1409717428,
  "attempt": 1,
  "usage": {
    "input": 21538,
    "output": 24,
    "cached_input": 0,
    "reasoning": 0
  },
  "latency_ms": 446,
  "gate_passed": true,
  "raw_response_ref": "6d7aa3a5-5abe-4dec-951c-56ecaed7e671.raw.json",
  "deviations": []
}
