{
  "run_id": "acade40e-d694-42a0-825d-9e2d4f1a470c",
  "model_id": "qwen-2.5-72b-instruct",
  "task_class": "T3",
  "instance_id": "T3-01",
  "seed": 1814924610,
  "attempt": 1,
  "usage": {
    "input": 145,
    "output": 50,
    "cached_input": 0,
    "reasoning": 0
  },
  "latency_ms": 107,
  "gate_passed": true,
  "raw_response_ref": "acade40e-d694-42a0-825d-9e2d4f1a470c.raw.json",
  "deviations": []
}
