{
  "run_id": "ba2aaa6f-bf19-4d57-9737-eb32dc7a5d8c",
  "model_id": "gpt-5.4-mini",
  "task_class": "T2",
  "instance_id": "T2-03",
  "seed": 1331161322,
  "attempt": 1,
  "usage": {
    "input": 21449,
    "output": 16,
    "cached_input": 0,
    "reasoning": 0
  },
  "latency_ms": 744,
  "gate_passed": false,
  "raw_response_ref": "ba2aaa6f-bf19-4d57-9737-eb32dc7a5d8c.raw.json",
  "deviations": []
}
