{
  "run_id": "4eb08f39-c1e8-4500-949f-01b54952817f",
  "model_id": "qwen-2.5-72b-instruct",
  "task_class": "T1",
  "instance_id": "T1-01",
  "seed": 863277272,
  "attempt": 1,
  "usage": {
    "input": 877,
    "output": 65,
    "cached_input": 0,
    "reasoning": 0
  },
  "latency_ms": 90,
  "gate_passed": true,
  "raw_response_ref": "4eb08f39-c1e8-4500-949f-01b54952817f.raw.json",
  "deviations": []
}
