{
  "run_id": "39d954fe-886f-4bf4-8458-ae13a314f6f7",
  "model_id": "mistral-small-3.2-24b-instruct",
  "task_class": "T3",
  "instance_id": "T3-03",
  "seed": 664901735,
  "attempt": 1,
  "usage": {
    "input": 102,
    "output": 62,
    "cached_input": 0,
    "reasoning": 0
  },
  "latency_ms": 1337,
  "gate_passed": true,
  "raw_response_ref": "39d954fe-886f-4bf4-8458-ae13a314f6f7.raw.json",
  "deviations": [
    "retry 1: OpenAI-compatible request failed: 429"
  ]
}
