{
  "run_id": "eacc8b89-5840-451a-83b5-dc369dac12c4",
  "model_id": "claude-sonnet-5",
  "task_class": "T2",
  "instance_id": "T2-03",
  "seed": 3235440980,
  "attempt": 1,
  "usage": {
    "input": 35700,
    "output": 25,
    "cached_input": 0,
    "reasoning": 0
  },
  "latency_ms": 1934,
  "gate_passed": true,
  "raw_response_ref": "eacc8b89-5840-451a-83b5-dc369dac12c4.raw.json",
  "deviations": []
}
